{
  "schemaVersion": "1.0",
  "equation": "sin(x)*cos(y)",
  "point": { "x": 1.5708, "y": 0.7854, "f": 0.7071 },
  "gradient": {
    "dfdx": 0.0,
    "dfdy": -0.7071,
    "magnitude": 0.7071,
    "steepestAscentHeadingDegrees": 270.0
  },
  "curvature": {
    "d2fdx2": -0.7071,
    "d2fdy2": -0.7071,
    "d2fdxdy": 0.0,
    "discriminant": 0.5
  },
  "classification": {
    "kind": "sloping, curving downward in both directions",
    "shape": "dome",
    "isCriticalPoint": false
  },
  "tangentPlane": { "equation": "f(x, y) = 0.71 + 0.00(x - 1.57) - 0.71(y - 0.79)" },
  "sampling": { "stepH": 0.05, "domainRange": 5.0, "criticalTolerance": 0.01, "curvatureTolerance": 0.001 }
}
